<xs:schema attributeFormDefault="unqualified" elementFormDefault="qualified" xmlns:xs="http://www.w3.org/2001/XMLSchema">
  <xs:element name="ListOfAnimals">
    <xs:complexType>
      <xs:sequence>
        <xs:element name="Animal" maxOccurs="unbounded" minOccurs="0">
          <xs:complexType>
            <xs:sequence>
              <xs:element name="AnimalInfo">
                <xs:complexType>
                  <xs:sequence>
                    <xs:element type="xs:string" name="Gender"/>
                    <xs:element type="xs:string" name="Name"/>
                    <xs:element type="xs:string" name="AnimalType"/>
                    <xs:element type="xs:string" name="Breed"/>
                    <xs:element type="xs:string" name="CountryOfOrigin"/>
                    <xs:element name="DateOfBirth">
                      <xs:complexType>
                        <xs:simpleContent>
                          <xs:extension base="xs:date">
                            <xs:attribute type="xs:string" name="format" use="optional"/>
                          </xs:extension>
                        </xs:simpleContent>
                      </xs:complexType>
                    </xs:element>
                    <xs:element type="xs:short" name="WeightKG"/>
                    <xs:element type="xs:short" name="HeightCM"/>
                    <xs:element type="xs:string" name="Coloring"/>
                    <xs:element type="xs:int" name="VaccinationID"/>
                    <xs:element name="EnteredSystem">
                      <xs:complexType>
                        <xs:simpleContent>
                          <xs:extension base="xs:date">
                            <xs:attribute type="xs:string" name="format" use="optional"/>
                          </xs:extension>
                        </xs:simpleContent>
                      </xs:complexType>
                    </xs:element>
                    <xs:element name="Changes">
                      <xs:complexType>
                        <xs:simpleContent>
                          <xs:extension base="xs:date">
                            <xs:attribute type="xs:string" name="format" use="optional"/>
                          </xs:extension>
                        </xs:simpleContent>
                      </xs:complexType>
                    </xs:element>
                    <xs:element name="LastVisit">
                      <xs:complexType>
                        <xs:simpleContent>
                          <xs:extension base="xs:date">
                            <xs:attribute type="xs:string" name="format" use="optional"/>
                          </xs:extension>
                        </xs:simpleContent>
                      </xs:complexType>
                    </xs:element>
                  </xs:sequence>
                </xs:complexType>
              </xs:element>
              <xs:element name="OwnerInfo">
                <xs:complexType>
                  <xs:sequence>
                    <xs:element type="xs:string" name="Name"/>
                    <xs:element type="xs:string" name="Surname"/>
                    <xs:element name="Phone">
                      <xs:complexType>
                        <xs:simpleContent>
                          <xs:extension base="xs:long">
                            <xs:attribute type="xs:string" name="type" use="optional"/>
                          </xs:extension>
                        </xs:simpleContent>
                      </xs:complexType>
                    </xs:element>
                    <xs:element type="xs:string" name="Email"/>
                    <xs:element type="xs:int" name="Fax"/>
                  </xs:sequence>
                </xs:complexType>
              </xs:element>
              <xs:element name="OwnerAdress">
                <xs:complexType>
                  <xs:sequence>
                    <xs:element type="xs:string" name="Street"/>
                    <xs:element name="Number">
                      <xs:complexType>
                        <xs:simpleContent>
                          <xs:extension base="xs:short">
                            <xs:attribute type="xs:string" name="adress" use="optional"/>
                          </xs:extension>
                        </xs:simpleContent>
                      </xs:complexType>
                    </xs:element>
                    <xs:element type="xs:string" name="City"/>
                    <xs:element type="xs:string" name="CityPart"/>
                    <xs:element type="xs:short" name="ZIP"/>
                    <xs:element type="xs:string" name="State"/>
                    <xs:element type="xs:string" name="StateRegion"/>
                  </xs:sequence>
                </xs:complexType>
              </xs:element>
              <xs:element name="LastVaccination">
                <xs:complexType>
                  <xs:choice maxOccurs="unbounded" minOccurs="0">
                    <xs:element name="Parvovirus">
                      <xs:complexType>
                        <xs:simpleContent>
                          <xs:extension base="xs:date">
                            <xs:attribute type="xs:string" name="format" use="optional"/>
                          </xs:extension>
                        </xs:simpleContent>
                      </xs:complexType>
                    </xs:element>
                    <xs:element name="CombinationVaccine">
                      <xs:complexType>
                        <xs:simpleContent>
                          <xs:extension base="xs:date">
                            <xs:attribute type="xs:string" name="format" use="optional"/>
                          </xs:extension>
                        </xs:simpleContent>
                      </xs:complexType>
                    </xs:element>
                    <xs:element name="Leptospirosis">
                      <xs:complexType>
                        <xs:simpleContent>
                          <xs:extension base="xs:date">
                            <xs:attribute type="xs:string" name="format" use="optional"/>
                          </xs:extension>
                        </xs:simpleContent>
                      </xs:complexType>
                    </xs:element>
                    <xs:element name="Coronavirus">
                      <xs:complexType>
                        <xs:simpleContent>
                          <xs:extension base="xs:date">
                            <xs:attribute type="xs:string" name="format" use="optional"/>
                          </xs:extension>
                        </xs:simpleContent>
                      </xs:complexType>
                    </xs:element>
                    <xs:element name="Lyme">
                      <xs:complexType>
                        <xs:simpleContent>
                          <xs:extension base="xs:date">
                            <xs:attribute type="xs:string" name="format" use="optional"/>
                          </xs:extension>
                        </xs:simpleContent>
                      </xs:complexType>
                    </xs:element>
                    <xs:element name="Worms">
                      <xs:complexType>
                        <xs:simpleContent>
                          <xs:extension base="xs:date">
                            <xs:attribute type="xs:string" name="format" use="optional"/>
                          </xs:extension>
                        </xs:simpleContent>
                      </xs:complexType>
                    </xs:element>
                    <xs:element name="Rabies">
                      <xs:complexType>
                        <xs:simpleContent>
                          <xs:extension base="xs:date">
                            <xs:attribute type="xs:string" name="format" use="optional"/>
                          </xs:extension>
                        </xs:simpleContent>
                      </xs:complexType>
                    </xs:element>
                    <xs:element name="Measles">
                      <xs:complexType>
                        <xs:simpleContent>
                          <xs:extension base="xs:date">
                            <xs:attribute type="xs:string" name="format" use="optional"/>
                          </xs:extension>
                        </xs:simpleContent>
                      </xs:complexType>
                    </xs:element>
                  </xs:choice>
                </xs:complexType>
              </xs:element>
            </xs:sequence>
          </xs:complexType>
        </xs:element>
      </xs:sequence>
    </xs:complexType>
  </xs:element>
</xs:schema>